{"clusters":[{"centroid":[0.003405,0.002044,0.001413,0.001167,0.00141,0.001872,0.002982,0.004542,0.005843,0.00551,0.005067,0.0052,0.005433,0.00581,0.006519,0.007039,0.007151,0.00787,0.007983,0.007053,0.006639,0.006399,0.005723,0.004367,0.00279,0.001471,0.000923,0.000772,0.001106,0.001708,0.003004,0.004958,0.006449,0.005962,0.005334,0.005414,0.005622,0.005965,0.00666,0.007173,0.007426,0.008504,0.009044,0.008287,0.008106,0.007984,0.007424,0.00535,0.003219,0.001736,0.001104,0.000902,0.00115,0.001762,0.003044,0.005122,0.006692,0.006337,0.005627,0.005711,0.005938,0.006191,0.006949,0.007553,0.008091,0.009128,0.009657,0.008865,0.008518,0.008589,0.007973,0.006029,0.003679,0.002068,0.001293,0.001035,0.001352,0.00193,0.003173,0.005153,0.006671,0.006373,0.005761,0.005791,0.006119,0.006481,0.007152,0.007837,0.008225,0.009314,0.00987,0.009382,0.009178,0.009177,0.008827,0.007165,0.004842,0.002934,0.001855,0.001363,0.001606,0.001982,0.0031,0.004824,0.006071,0.005872,0.005682,0.005927,0.006478,0.0069,0.007646,0.00819,0.008621,0.00955,0.010388,0.010396,0.009338,0.009234,0.009971,0.009787,0.007681,0.005438,0.003924,0.003036,0.002497,0.001932,0.002248,0.00306,0.003951,0.005194,0.006324,0.007353,0.008099,0.008573,0.009146,0.010072,0.010746,0.011517,0.011577,0.011603,0.010749,0.010443,0.01062,0.010242,0.008746,0.006406,0.00443,0.003427,0.002821,0.002077,0.002158,0.002749,0.003384,0.004651,0.00591,0.006859,0.007494,0.007781,0.008265,0.008571,0.00909,0.009423,0.009005,0.008097,0.007351,0.00676,0.006183,0.005016],"feature_ratios_vs_city":{"am":0.7060276346427585,"night":1.0301255215532175,"pm":1.1027399677300316,"wkend":1.0521482419993096},"id":0,"label":"Evening-leaning core","members":[7,8,12,13,17,25,27,31,33,34,40,41,43,46,49,52,54,61,62,65,66,68,82,87,88,90,92,96,97,99,100,106,107,111,113,118,125,128,130,132,137,138,142,145,146,153,154,161,162,163,164,166,170,181,184,186,189,190,194,195,198,201,209,211,217,225,228,229,230,231,232,234,237,239,246,247,253,261],"share_of_trips":0.44072742287709243,"size":78},{"centroid":[0.003591,0.002342,0.001666,0.001554,0.002282,0.003322,0.005442,0.008622,0.010185,0.00791,0.006524,0.005979,0.005952,0.006336,0.007145,0.007079,0.006894,0.007227,0.006595,0.00563,0.005004,0.004501,0.004257,0.003701,0.002511,0.001519,0.001081,0.001122,0.001891,0.003036,0.005461,0.009173,0.010785,0.008389,0.0068,0.006216,0.006155,0.006495,0.007492,0.007433,0.007264,0.007826,0.007282,0.006348,0.0056,0.00504,0.004809,0.004119,0.002712,0.001692,0.001221,0.001207,0.001947,0.003119,0.005584,0.009453,0.011143,0.00863,0.006972,0.006386,0.006427,0.00679,0.007852,0.00771,0.00774,0.008372,0.007705,0.006624,0.00581,0.005345,0.005059,0.004347,0.002941,0.001817,0.00129,0.001325,0.002078,0.003286,0.005806,0.0096,0.011238,0.008835,0.007283,0.006688,0.006591,0.006977,0.007996,0.007971,0.008008,0.008682,0.008075,0.007159,0.006335,0.005777,0.005554,0.004898,0.003508,0.002211,0.001572,0.001513,0.002272,0.003414,0.005815,0.009575,0.011069,0.00875,0.007364,0.007015,0.00713,0.007604,0.008571,0.008545,0.008579,0.009283,0.00929,0.008742,0.007687,0.007165,0.007248,0.006927,0.005553,0.004038,0.003027,0.002581,0.002751,0.002952,0.003995,0.005042,0.006178,0.006926,0.007057,0.00729,0.00742,0.007666,0.007908,0.008048,0.008043,0.008406,0.008815,0.008855,0.008487,0.008096,0.00819,0.007965,0.006685,0.005158,0.003792,0.003142,0.003049,0.002945,0.003643,0.00434,0.004775,0.005843,0.006698,0.006787,0.006713,0.006884,0.007081,0.007074,0.006783,0.006858,0.006839,0.006497,0.006213,0.005888,0.005588,0.004944],"feature_ratios_vs_city":{"am":1.1906067003902765,"night":0.9108336425290136,"pm":0.9672583500595104,"wkend":0.9439843812186487},"id":1,"label":"Weekday commuter","members":[3,5,6,9,10,11,14,15,16,18,19,20,21,22,23,24,26,28,29,32,35,38,39,42,44,47,50,51,53,55,56,57,58,59,60,63,64,67,69,70,71,72,73,74,75,76,77,78,81,83,84,85,86,89,91,94,95,98,101,102,108,109,115,116,117,119,120,121,122,123,124,126,127,129,131,133,134,135,136,139,140,141,143,147,149,150,151,152,155,156,157,159,160,165,167,168,169,171,172,173,174,175,176,177,178,179,180,182,183,185,187,188,191,192,193,196,197,200,202,203,204,205,206,207,208,210,212,213,214,215,216,218,219,220,221,222,223,224,226,227,233,235,236,238,240,241,242,243,244,245,248,250,251,252,254,257,258,259,260,262,263],"share_of_trips":0.4351267444033012,"size":161},{"centroid":[0.004713,0.003109,0.002249,0.001691,0.001779,0.001865,0.002599,0.003376,0.004268,0.00407,0.003579,0.003513,0.00371,0.003997,0.004368,0.004582,0.004757,0.005365,0.005806,0.0057,0.005601,0.006277,0.00621,0.004729,0.003372,0.001994,0.001323,0.000894,0.001185,0.001578,0.00254,0.003626,0.004786,0.004644,0.003749,0.003637,0.003736,0.003853,0.004191,0.004548,0.004624,0.005592,0.006702,0.006899,0.007401,0.00875,0.008727,0.006574,0.004454,0.002646,0.001597,0.001166,0.00138,0.00167,0.002623,0.00374,0.004955,0.004955,0.003959,0.003937,0.004279,0.004242,0.004574,0.004841,0.005199,0.006261,0.007227,0.007443,0.007758,0.009599,0.009796,0.008208,0.00589,0.003542,0.002259,0.001529,0.001643,0.001911,0.002779,0.003884,0.004976,0.005102,0.004356,0.004096,0.004202,0.004385,0.004805,0.005121,0.005542,0.006497,0.007439,0.007992,0.008298,0.009815,0.010761,0.010454,0.008612,0.006104,0.004248,0.002812,0.002349,0.002044,0.002738,0.003638,0.004482,0.004514,0.004419,0.004353,0.004706,0.004996,0.005368,0.005752,0.006245,0.007383,0.009391,0.010881,0.010472,0.011422,0.014414,0.016029,0.016234,0.0156,0.013033,0.008881,0.005163,0.00246,0.00228,0.002557,0.003191,0.0042,0.005234,0.005892,0.006749,0.007334,0.00774,0.008374,0.009402,0.010393,0.011803,0.013134,0.012942,0.014099,0.015934,0.017172,0.017613,0.016808,0.013587,0.009898,0.006068,0.002876,0.002375,0.002339,0.002697,0.003657,0.004714,0.005621,0.00624,0.006651,0.006873,0.007007,0.007701,0.008059,0.008044,0.00786,0.007657,0.007918,0.007536,0.006401],"feature_ratios_vs_city":{"am":0.5436568079429542,"night":1.7062348748045784,"pm":0.8386875386750804,"wkend":1.2912324557559665},"id":2,"label":"Late-night weekend","members":[4,30,36,37,45,48,79,80,93,112,114,144,148,158,249,255,256],"share_of_trips":0.12414583271960639,"size":17}],"excluded_zones":[1,2,103,104,105,110,199],"features":"L1-normalized 168-hour weekly pickup profile (all services), k-means n_init=10 seed=20240101","k":3,"label_rule":"night>=1.4x city (share of trips 22:00-05:59) -> Late-night weekend; weekend share>=1.25x -> Weekend leisure; weekday 06-09 share>=1.1x -> Weekday commuter; weekday 16-19 share>=1.05x and 06-09 <=0.85x -> Evening-leaning core; else All-day mixed","min_zone_trips":5000,"random_label_silhouette":{"max":0.005997613001419123,"mean":-0.0475425829751301},"schema_version":"v1","silhouette":0.33271161304346575,"silhouette_by_k":{"3":0.33271161304346575,"4":0.3050103410337388,"5":0.24663162695586718,"6":0.17181535801209594,"7":0.19088874538041356,"8":0.16257422495737284},"stability_ari":{"ari_mean":0.9659854651650643,"ari_min":0.8925743028941278,"n_seeds":10},"tags":{"labels":"DERIVED","profile":"DERIVED","silhouette":"DERIVED"}}
